{
  "schema_version": "1.0",
  "kind": "blabee_decision_packet",
  "decision_layout": "ranked_next_actions",
  "interaction_id": "interaction_fixture_ranked_001",
  "packet_id": "packet_fixture_ranked_001",
  "revision": 1,
  "project_id": "project_fixture_alpha",
  "session_id": "session_fixture_ranked",
  "source_turn_id": "turn_fixture_ranked_001",
  "source_prompt_id": "prompt_fixture_ranked_001",
  "episode_id": "episode_fixture_ranked",
  "episode_root_prompt_id": "prompt_fixture_ranked_001",
  "episode_baseline_checkpoint_id": "checkpoint_fixture_before_prompt_ranked_001",
  "decision_boundary_id": "boundary_fixture_ranked_001",
  "boundary_sequence": 1,
  "valid_after_event_sequence": 30,
  "sealed_at": "2026-01-15T09:03:00Z",
  "expires_at": "2026-01-15T09:05:00Z",
  "summary": "Four fictional next actions are ready in priority order.",
  "evidence": [],
  "risk": {
    "level": "low",
    "reasons": [
      "fixture_only"
    ]
  },
  "checkpoint": {
    "id": "checkpoint_fixture_before_prompt_ranked_001",
    "coverage": "contract_only"
  },
  "choices": [
    {
      "slot": 1,
      "kind": "recommended_action",
      "enabled": true,
      "disabled_reason": null,
      "option_id": "option_fixture_ranked_001",
      "action_id": "action_fixture_ranked_001",
      "action": {
        "title": "Review the ranked fictional result",
        "objective": "Review the ranked fictional result first.",
        "constraints": [
          "Keep the review scoped to the fictional fixture."
        ],
        "done_when": [
          "The ranked review is recorded."
        ]
      }
    },
    {
      "slot": 2,
      "kind": "alternative_action",
      "enabled": true,
      "disabled_reason": null,
      "option_id": "option_fixture_ranked_002",
      "action_id": "action_fixture_ranked_002",
      "action": {
        "title": "Run the ranked compatibility check",
        "objective": "Run deterministic compatibility samples second.",
        "constraints": [
          "Use only fictional fixture inputs."
        ],
        "done_when": [
          "Every compatibility sample has a result."
        ]
      }
    },
    {
      "slot": 3,
      "kind": "alternative_action",
      "enabled": true,
      "disabled_reason": null,
      "option_id": "option_fixture_ranked_003",
      "action_id": "action_fixture_ranked_003",
      "action": {
        "title": "Inspect the ranked boundary",
        "objective": "Inspect the fictional boundary without modifying it.",
        "constraints": [
          "Keep the inspection read-only."
        ],
        "done_when": [
          "The boundary inspection is recorded."
        ]
      }
    },
    {
      "slot": 4,
      "kind": "alternative_action",
      "enabled": true,
      "disabled_reason": null,
      "option_id": "option_fixture_ranked_004",
      "action_id": "action_fixture_ranked_004",
      "action": {
        "title": "Split the next fictional task",
        "objective": "Split the next fictional task into a smaller implementation slice.",
        "constraints": [
          "Do not execute the resulting slice yet."
        ],
        "done_when": [
          "The smaller slice has explicit completion conditions."
        ]
      }
    }
  ]
}
